{
  "schema_version": 41,
  "bundle_id": "cascade-core",
  "bundle_version": 42,
  "policies": [
    { "id": "TAP-001", "version": 1, "priority": "TOPOLOGY", "match_all": ["always"], "match_any": [], "required_controls": ["BASE"], "forbidden_controls": [], "minimum_route": null, "minimum_assurance": null, "minimum_evidence": null, "approval": null, "conflict_set": null, "rationale": "Every request receives the cheap admission microkernel.", "invalidation": ["request"] },
    { "id": "TAP-002", "version": 1, "priority": "ASSURANCE", "match_all": [], "match_any": ["current-state", "review", "diagnose", "status"], "required_controls": ["GROUNDED_READ"], "forbidden_controls": [], "minimum_route": "DIRECT_READ", "minimum_assurance": null, "minimum_evidence": "TARGETED", "approval": null, "conflict_set": null, "rationale": "Current-state reads require bounded grounding.", "invalidation": ["source", "time"] },
    { "id": "TAP-003", "version": 1, "priority": "TOPOLOGY", "match_all": ["atomic-change"], "match_any": [], "required_controls": ["ATOMIC_CHANGE"], "forbidden_controls": ["PROGRAM_CONTROL"], "minimum_route": "DIRECT_CHANGE", "minimum_assurance": null, "minimum_evidence": "TARGETED", "approval": null, "conflict_set": null, "rationale": "Mechanical local edits stay lightweight.", "invalidation": ["scope", "source"] },
    { "id": "TAP-004", "version": 1, "priority": "TOPOLOGY", "match_all": ["behavior-change"], "match_any": [], "required_controls": ["STANDARD_CHANGE"], "forbidden_controls": [], "minimum_route": "BOUNDED", "minimum_assurance": "STANDARD", "minimum_evidence": "REGRESSION", "approval": null, "conflict_set": null, "rationale": "Behavior and public-contract changes require a plan and regression.", "invalidation": ["scope", "source"] },
    { "id": "TAP-005", "version": 2, "priority": "TOPOLOGY", "match_all": [], "match_any": ["connected"], "required_controls": ["CONNECTED_DELIVERY"], "forbidden_controls": [], "minimum_route": "CONNECTED", "minimum_assurance": null, "minimum_evidence": "REGRESSION", "approval": null, "conflict_set": null, "rationale": "Mutation or operation dependencies need durable checkpoints and repair; read-only duration signals do not activate change controls.", "invalidation": ["scope", "plan"] },
    { "id": "TAP-006", "version": 1, "priority": "TOPOLOGY", "match_all": [], "match_any": ["program", "release-join", "multi-owner"], "required_controls": ["PROGRAM_CONTROL"], "forbidden_controls": [], "minimum_route": "PROGRAM", "minimum_assurance": null, "minimum_evidence": "INDEPENDENT", "approval": null, "conflict_set": null, "rationale": "Program-shaped work needs worklines and terminal joins.", "invalidation": ["scope", "graph", "owner"] },
    { "id": "TAP-007", "version": 2, "priority": "HAZARD", "match_all": [], "match_any": ["auth", "tenant", "secret", "payment", "safety", "external-write", "privileged", "destructive", "prompt-injection"], "required_controls": ["SECURITY_ASSURANCE"], "forbidden_controls": [], "minimum_route": null, "minimum_assurance": "HIGH", "minimum_evidence": "INDEPENDENT", "approval": null, "conflict_set": null, "rationale": "Small effort cannot downgrade a trust, security, or authority boundary.", "invalidation": ["permission", "policy", "scope"] },
    { "id": "TAP-008", "version": 1, "priority": "ASSURANCE", "match_all": [], "match_any": ["full-scan", "unknown-public-boundary", "migration"], "required_controls": ["FULL_SCAN"], "forbidden_controls": [], "minimum_route": null, "minimum_assurance": null, "minimum_evidence": "REGRESSION", "approval": null, "conflict_set": null, "rationale": "Only an explicit or unresolved broad boundary activates a full scan.", "invalidation": ["source", "boundary"] },
    { "id": "TAP-009", "version": 1, "priority": "ASSURANCE", "match_all": [], "match_any": ["release", "deploy", "merge-eligible"], "required_controls": ["RELEASE_EVIDENCE"], "forbidden_controls": [], "minimum_route": null, "minimum_assurance": "HIGH", "minimum_evidence": "RELEASE", "approval": null, "conflict_set": null, "rationale": "Release claims require current independent environment-bound evidence.", "invalidation": ["source", "environment", "time"] },
    { "id": "TAP-010", "version": 1, "priority": "HARD_DENY", "match_all": ["conflicting-authority"], "match_any": [], "required_controls": [], "forbidden_controls": [], "minimum_route": null, "minimum_assurance": null, "minimum_evidence": null, "approval": null, "conflict_set": "authority", "rationale": "Conflicting authoritative claims fail closed.", "invalidation": ["request", "permission"] },
    { "id": "TAP-011", "version": 2, "priority": "ASSURANCE", "match_all": ["simulation"], "match_any": [], "required_controls": ["SIMULATION_GOVERNANCE"], "forbidden_controls": [], "minimum_route": "BOUNDED", "minimum_assurance": "STANDARD", "minimum_evidence": "TARGETED", "approval": null, "conflict_set": null, "rationale": "Ordinary simulation authoring and execution use one bounded dynamic actor, an interface adapter, a fixed brief and outcome, and observable terminal evidence.", "invalidation": ["task-envelope", "adapter", "actor", "brief", "outcome", "policy", "source"] },
    { "id": "TAP-012", "version": 3, "priority": "APPROVAL", "match_all": [], "match_any": ["requested-external-write", "requested-privileged", "requested-destructive"], "required_controls": ["SECURITY_ASSURANCE"], "forbidden_controls": [], "minimum_route": "BOUNDED", "minimum_assurance": "HIGH", "minimum_evidence": "INDEPENDENT", "approval": "trusted-host-hard-action-receipt", "conflict_set": null, "rationale": "A hard action requires trusted direct-user source provenance before a trusted host can verify current session and revision, exact action, canonical tool, target, tool call, expiry, revocation, and single-use consumption.", "invalidation": ["permission", "request", "target", "tool", "session", "revision", "revocation", "use"] },
    { "id": "TAP-013", "version": 1, "priority": "ASSURANCE", "match_all": ["simulation-campaign"], "match_any": [], "required_controls": ["SIMULATION_GOVERNANCE", "CONNECTED_DELIVERY"], "forbidden_controls": [], "minimum_route": "CONNECTED", "minimum_assurance": "HIGH", "minimum_evidence": "INDEPENDENT", "approval": null, "conflict_set": null, "rationale": "Controlled comparisons, calibration, release evidence, and other explicit simulation campaigns require versioned campaign governance and independent evidence.", "invalidation": ["task-envelope", "product-context", "campaign", "policy", "source"] }
  ]
}
